News_Source,Title,Source_URL,Publish_Date,Category,Summary,Scrape_Date
Utusan Malaysia,"Rakyat perlu hukum kerajaan rosak, muflis moral",https://www.utusan.com.my/nasional/2022/12/rakyat-perlu-hukum-kerajaan-rosak-muflis-moral/,,,No content available,2025-08-06
Utusan Malaysia,Utusan Malaysia tingkat pengukuhan bahasa Melayu di sekolah,https://www.utusan.com.my/nasional/2024/04/utusan-malaysia-tingkat-pengukuhan-bahasa-melayu-di-sekolah/,,,No content available,2025-08-06
Utusan Malaysia,Agong berkenan hadir acara dan majlis sempena sambutan ulang tahun keputeraan baginda - Utusan Malaysia,https://www.utusan.com.my/nasional/2018/09/agong-berkenan-hadir-acara-dan-majlis-sempena-sambutan-ulang-tahun-keputeraan-baginda/,,,No content available,2025-08-06
Utusan Malaysia,Sampai bila Tun M mahu dibohongi? - Utusan Malaysia,https://www.utusan.com.my/rencana/forum/2022/10/sampai-bila-tun-m-mahu-dibohongi/,,,No content available,2025-08-06
Utusan Malaysia,mmCineplexes Plus saji pengalaman berbeza - Utusan Malaysia,https://www.utusan.com.my/gaya/hiburan/2024/03/mmcineplexes-plus-saji-pengalaman-berbeza/,,,No content available,2025-08-06
Utusan Malaysia,"Talent Corp, Yayasan Pahang asah peluang kerja untuk 12,000 graduan - Utusan Malaysia",https://www.utusan.com.my/terkini/2021/12/talent-corp-yayasan-pahang-asah-peluang-kerja-untuk-12000-graduan/,,,No content available,2025-08-06
Utusan Malaysia,Hazmat buka pusat kawalan di Kampung Kuala Koh - Utusan Malaysia,https://www.utusan.com.my/nasional/2019/06/hazmat-buka-pusat-kawalan-di-kampung-kuala-koh/,,,No content available,2025-08-06
Utusan Malaysia,"Selangor terus sumbang kematian terbanyak, 98 kes meninggal di rumah - Utusan Malaysia",https://www.utusan.com.my/terkini/2021/08/selangor-terus-sumbang-kematian-terbanyak-98-kes-meninggal-di-rumah/,,,No content available,2025-08-06
Utusan Malaysia,Wujud suruhanjaya pendidikan demi perpaduan - Utusan Malaysia,https://www.utusan.com.my/nasional/2021/09/wujud-suruhanjaya-pendidikan-demi-perpaduan/,,,No content available,2025-08-06
Utusan Malaysia,"BN akan bangkit, Madius khianati kepercayaan rakyat - Utusan Malaysia",https://www.utusan.com.my/nasional/2018/06/bn-akan-bangkit-madius-khianati-kepercayaan-rakyat/,,,No content available,2025-08-06
Utusan Malaysia,Hana Medic sasar 80% hasil eksport - Utusan Malaysia,https://www.utusan.com.my/nasional/2018/09/hana-medic-sasar-80-hasil-eksport/,,,No content available,2025-08-06
Utusan Malaysia,Unjam jadi penyelamat tiga nelayan selepas bot dipukul ribut,https://www.utusan.com.my/nasional/2023/08/unjam-jadi-penyelamat-tiga-nelayan-selepas-bot-dipukul-ribut/,,,No content available,2025-08-06
Utusan Malaysia,Peniaga warga asing cedera bungkusan dibuka meletup - Utusan Malaysia,https://www.utusan.com.my/nasional/2023/07/peniaga-warga-asing-cedera-bungkusan-dibuka-meletup/,,,No content available,2025-08-06
Utusan Malaysia,Anak Pahang usia 12 tahun menang dua pingat emas di London - Utusan Malaysia,https://www.utusan.com.my/berita/2022/08/anak-pahang-12-tahun-menang-dua-pingat-emas-di-london/,,,No content available,2025-08-06
Utusan Malaysia,Boeing 787 sekali lagi mengalami masalah - Utusan Malaysia,https://www.utusan.com.my/nasional/2019/03/boeing-787-sekali-lagi-mengalami-masalah/,,,No content available,2025-08-06
Utusan Malaysia,"Daun ketum bernilai RM135,000 gagal diseludup ke Thailand  - Utusan Malaysia",https://www.utusan.com.my/nasional/2021/08/daun-ketum-bernilai-rm135000-gagal-diseludup-ke-thailand/,,,No content available,2025-08-06
Utusan Malaysia,Kontraktor mengaku tidak bersalah tikam isteri - Utusan Malaysia,https://www.utusan.com.my/nasional/2022/05/kontraktor-mengaku-tidak-bersalah-tikam-isteri/,,,No content available,2025-08-06
Utusan Malaysia,Gerakan tidak ubah seperti DAP - Utusan Malaysia,https://www.utusan.com.my/nasional/2019/09/gerakan-tidak-ubah-seperti-dap/,,,No content available,2025-08-06
Utusan Malaysia,114 peniaga BRR Madani tawar Menu Rahmah,https://www.utusan.com.my/berita/2024/03/114-peniaga-brr-madani-tawar-menu-rahmah/,,,No content available,2025-08-06
Utusan Malaysia,Normal Woo-Jin dapat ‘perfect 10’ - Utusan Malaysia,https://www.utusan.com.my/sukan/2021/08/normal-woo-jin-dapat-perfect-10/,,,No content available,2025-08-06
Utusan Malaysia,Hospital swasta diseru sertai program Hospital Mesra Ibadah,https://www.utusan.com.my/nasional/2022/09/hospital-swasta-diseru-sertai-program-hospital-mesra-ibadah/,,,No content available,2025-08-06
Utusan Malaysia,Sambutan perayaan wadah penyatuan rakyat - Utusan Malaysia,https://www.utusan.com.my/nasional/2019/06/sambutan-perayaan-wadah-penyatuan-rakyat/,,,No content available,2025-08-06
Utusan Malaysia,"Pengawal keselamatan mengaku salah rogol, cabul remaja - Utusan Malaysia",https://www.utusan.com.my/berita/2023/09/pengawal-keselamatan-mengaku-salah-rogol-cabul-remaja/,,,No content available,2025-08-06
Utusan Malaysia,Anjing liar meresahkan penduduk,https://www.utusan.com.my/rencana/forum/2023/05/anjing-liar-meresahkan-penduduk/,,,No content available,2025-08-06
Utusan Malaysia,"Masuk hari ke-14 hilang, di mana Bella?",https://www.utusan.com.my/nasional/2023/12/masuk-hari-ke-14-hilang-di-mana-bella/,,,No content available,2025-08-06
Utusan Malaysia,Saman rakan RM7.4 juta kerana cinta ditolak - Utusan Malaysia,https://www.utusan.com.my/luar-negara/2023/02/saman-rakan-rm7-4-juta-kerana-cinta-ditolak/,,,No content available,2025-08-06
Utusan Malaysia,"11,000 klinik, farmasi risiko tutup ubat habis",https://www.utusan.com.my/berita/2022/07/11000-klinik-farmasi-risiko-tutup-ubat-habis/,,,No content available,2025-08-06
Utusan Malaysia,Sistem amaran kepala air Yan beroperasi awal Jun,https://www.utusan.com.my/berita/2023/05/sistem-amaran-kepala-air-yan-beroperasi-awal-jun/,,,No content available,2025-08-06
Utusan Malaysia,"Penyanyi baharu, orangnya segak, sopan santun tapi jadi hasad dengki. - Utusan Malaysia",https://www.utusan.com.my/gaya/hiburan/2021/04/103947/,,,No content available,2025-08-06
Utusan Malaysia,Beri tiket percuma kerana  takut dimarah pelancong asing - Utusan Malaysia,https://www.utusan.com.my/nasional/2018/11/beri-tiket-percuma-kerana-takut-dimarah-pelancong-asing/,,,No content available,2025-08-06
Utusan Malaysia,Sembilan militan terbunuh dalam pertempuran di Filipina,https://www.utusan.com.my/luar-negara/2024/01/sembilan-militan-terbunuh-dalam-pertempuran-di-filipina/,,,No content available,2025-08-06
Utusan Malaysia,Belum rezeki Pearly-Thinaah,https://www.utusan.com.my/sukan/2023/09/belum-rezeki-pearly-thinaah/,,,No content available,2025-08-06
Utusan Malaysia,"Ustaz dipenjara lima bulan, denda RM8,000 buat hantaran jelik terhadap Agong - Utusan Malaysia",https://www.utusan.com.my/nasional/2024/03/ustaz-dipenjara-lima-bulan-denda-rm8000-buat-hantaran-jelik-terhadap-agong/,,,No content available,2025-08-06
Utusan Malaysia,Presiden UMNO wakili parti buat perundingan politik - Utusan Malaysia,https://www.utusan.com.my/nasional/2019/07/presiden-umno-wakili-parti-buat-perundingan-politik/,,,No content available,2025-08-06
Utusan Malaysia,"Tolak kenyataan tidak selari, Pemuda Pas teguh bersama Presiden - Utusan Malaysia",https://www.utusan.com.my/terkini/2021/11/tolak-kenyataan-tidak-selari-pemuda-pas-teguh-bersama-presiden/,,,No content available,2025-08-06
Utusan Malaysia,Kalau masih RM100 saya takkan mohon dah - OKU Ishak - Utusan Malaysia,https://www.utusan.com.my/nasional/2019/02/kalau-masih-rm100-saya-takkan-mohon-dah-oku-ishak/,,,No content available,2025-08-06
Utusan Malaysia,Tidak adil beri layanan istimewa kepada doktor kontrak - Utusan Malaysia,https://www.utusan.com.my/rencana/forum/2021/08/tidak-adil-beri-layanan-istimewa-kepada-doktor-kontrak/,,,No content available,2025-08-06
Utusan Malaysia,Amron ‘berbudi’ di pameran seni,https://www.utusan.com.my/rencana/forum/2023/08/amron-berbudi-di-pameran-seni/,,,No content available,2025-08-06
Utusan Malaysia,"Bapa lima anak didakwa rogol anak kandung, mangsa dijadikan hamba seks - Utusan Malaysia",https://www.utusan.com.my/terkini/2021/06/bapa-lima-anak-didakwa-rogol-anak-kandung-mangsa-dijadikan-hamba-seks/,,,No content available,2025-08-06
Utusan Malaysia,"Pimpinan Kerajaan Perpaduan mula tiba WTC, ikuti perkembangan PRN",https://www.utusan.com.my/nasional/2023/08/pimpinan-parti-kerajaan-perpaduan-mula-tiba-wtc-ikuti-perkembangan-prn/,,,No content available,2025-08-06
Utusan Malaysia,Zakaria calon BN terbaik di DUN Semenyih - Utusan Malaysia,https://www.utusan.com.my/nasional/2019/02/zakaria-calon-bn-terbaik-di-dun-semenyih/,,,No content available,2025-08-06
